{"$defs":{"CausalDigest":{"pattern":"^[0-9a-f]{64}$","type":"string"},"ContentID":{"pattern":"^[0-9a-f]{64}$","type":"string"},"bounded_utf8_registry_string":{"maxLength":128,"minLength":1,"type":"string"},"bounded_utf8_registry_string_256":{"maxLength":256,"minLength":1,"type":"string"},"i128s":{"pattern":"^(0|-?[1-9][0-9]*)$","type":"string"},"rfc3339_full_date":{"pattern":"^[0-9]{4}-[0-9]{2}-[0-9]{2}$","type":"string"},"rfc3339_ns_utc":{"pattern":"^[0-9]{4}-[0-9]{2}-[0-9]{2}T[0-9]{2}:[0-9]{2}:[0-9]{2}\\.[0-9]{9}Z$","type":"string"},"safe_relative_path":{"pattern":"^(?![A-Za-z]:)(?!/)(?!\\.{1,2}(?:/|$))(?!.*(?:/\\.{1,2})(?:/|$))(?!.*//)[^/\\\\:\\x00]+(?:/[^/\\\\:\\x00]+)*$","type":"string"},"sha256":{"pattern":"^[0-9a-f]{64}$","type":"string"},"sq18s":{"pattern":"^(0|-?[1-9][0-9]*)$","type":"string"},"u64s":{"pattern":"^(0|[1-9][0-9]*)$","type":"string"},"uints":{"pattern":"^(0|[1-9][0-9]*)$","type":"string"},"uq18s":{"pattern":"^(0|[1-9][0-9]*)$","type":"string"}},"$id":"urn:build-finance:contract:model-signal:v1","$schema":"https://json-schema.org/draft/2020-12/schema","additionalProperties":false,"properties":{"action":{"enum":["ABSTAIN","LONG_BIAS","EXIT_BIAS"]},"adapter_sha256":{"anyOf":[{"$ref":"#/$defs/sha256"},{"type":"null"}]},"as_of_ingest_sequence":{"$ref":"#/$defs/u64s"},"available_replay_clock_ns":{"$ref":"#/$defs/u64s"},"calibration_sha256":{"$ref":"#/$defs/sha256"},"calibration_version":{"$ref":"#/$defs/bounded_utf8_registry_string"},"decision_close_replay_clock_ns":{"$ref":"#/$defs/u64s"},"decision_sequence":{"$ref":"#/$defs/u64s"},"expires_replay_clock_ns":{"$ref":"#/$defs/u64s"},"feature_set_version":{"$ref":"#/$defs/bounded_utf8_registry_string"},"feature_snapshot_id":{"$ref":"#/$defs/ContentID"},"horizon_ns":{"$ref":"#/$defs/u64s"},"inference_duration_ns":{"$ref":"#/$defs/u64s"},"issued_replay_clock_ns":{"$ref":"#/$defs/u64s"},"market_id":{"$ref":"#/$defs/bounded_utf8_registry_string"},"model_artifact_sha256":{"$ref":"#/$defs/sha256"},"model_id":{"$ref":"#/$defs/bounded_utf8_registry_string"},"model_version":{"$ref":"#/$defs/bounded_utf8_registry_string"},"ood_score_q18":{"$ref":"#/$defs/uq18s"},"probability_abstain_q18":{"$ref":"#/$defs/uq18s"},"probability_exit_bias_q18":{"$ref":"#/$defs/uq18s"},"probability_long_bias_q18":{"$ref":"#/$defs/uq18s"},"producer_id":{"$ref":"#/$defs/bounded_utf8_registry_string"},"producer_sequence":{"$ref":"#/$defs/u64s"},"runtime_profile_id":{"$ref":"#/$defs/bounded_utf8_registry_string"},"schema":{"const":"trading.model-signal/v1"},"score_q18":{"$ref":"#/$defs/sq18s"},"signal_id":{"$ref":"#/$defs/ContentID"},"ttl_ns":{"$ref":"#/$defs/u64s"},"uncertainty_q18":{"$ref":"#/$defs/uq18s"}},"required":["schema","signal_id","producer_id","producer_sequence","model_id","model_version","runtime_profile_id","calibration_version","model_artifact_sha256","adapter_sha256","calibration_sha256","feature_snapshot_id","feature_set_version","market_id","horizon_ns","decision_sequence","as_of_ingest_sequence","issued_replay_clock_ns","available_replay_clock_ns","decision_close_replay_clock_ns","ttl_ns","expires_replay_clock_ns","action","score_q18","probability_abstain_q18","probability_long_bias_q18","probability_exit_bias_q18","uncertainty_q18","ood_score_q18","inference_duration_ns"],"type":"object","x-contract-schema":"trading.model-signal/v1"}
