{
  "schema": "trading.model-signal/v1",
  "signal_id": "73c0c4ceedc5701ec48679e5562334bb778c660d04222859ec4e34d3e5817616",
  "producer_id": "offline-model-fixture-producer",
  "producer_sequence": "0",
  "model_id": "unpromoted-diagnostic-model",
  "model_version": "diagnostic-version-1",
  "runtime_profile_id": "offline-cached-signal/v1",
  "calibration_version": "diagnostic-calibration-1",
  "model_artifact_sha256": "aaaaaaaaaaaaaaaaaaaaaaaaaaaaaaaaaaaaaaaaaaaaaaaaaaaaaaaaaaaaaaaa",
  "adapter_sha256": null,
  "calibration_sha256": "acacacacacacacacacacacacacacacacacacacacacacacacacacacacacacacac",
  "feature_snapshot_id": "338c961a3031ed7884f23848e34515510683a9646cf07a28f185cde613b49b39",
  "feature_set_version": "solana-jupiter-deterministic-features/v1",
  "market_id": "fixture-base-mint/fixture-quote-mint:jupiter",
  "horizon_ns": "30000000000",
  "decision_sequence": "1",
  "as_of_ingest_sequence": "1",
  "issued_replay_clock_ns": "0",
  "available_replay_clock_ns": "1",
  "decision_close_replay_clock_ns": "2",
  "ttl_ns": "5000000000",
  "expires_replay_clock_ns": "5000000000",
  "action": "ABSTAIN",
  "score_q18": "0",
  "probability_abstain_q18": "1000000000000000000",
  "probability_long_bias_q18": "0",
  "probability_exit_bias_q18": "0",
  "uncertainty_q18": "1000000000000000000",
  "ood_score_q18": "1000000000000000000",
  "inference_duration_ns": "0"
}
